<?xml version="1.0" encoding="UTF-8"?>
<Világbajnokság_DLWGQZ xmlns:xsi="http://www.w3.org/2001/XMLSchema-instance" xsi:noNamespaceSchemaLocation="XMLSchemaDLWGQZ.xsd">
 <Csapat CSOPkód="11" CSkód="1" Csapatkapitány="CR7" LOGÓkód="21">
  <Vezetõedzõ >Roberto Martínez</Vezetõedzõ>
  <Név >Portugália</Név>
 </Csapat>

 <Csapat CSOPkód="12" CSkód="2" Csapatkapitány="TS1" LOGÓkód="22">
  <Vezetõedzõ >Hansi Flick</Vezetõedzõ>
  <Név >Németország</Név>
 </Csapat>

 <Csapat CSOPkód="13" CSkód="3" Csapatkapitány="KM10" LOGÓkód="23">
  <Vezetõedzõ >Didier Deschamp</Vezetõedzõ>
  <Név >Franciaország</Név>
 </Csapat>

 <Csapat CSOPkód="14" CSkód="4" Csapatkapitány="HK9" LOGÓkód="24">
  <Vezetõedzõ >Gareth Southgate</Vezetõedzõ>
  <Név >Anglia</Név>
 </Csapat>

 <Csapat CSOPkód="15" CSkód="5" Csapatkapitány="LM10" LOGÓkód="25">
  <Vezetõedzõ >Lionel Scaloni</Vezetõedzõ>
  <Név >Argentína</Név>
 </Csapat>


 <Logó LOGÓKód="21">
  <Színek >Piros</Színek>
  <Színek >Kék</Színek>
  <Színek >Zöld</Színek>
  <Tervezõ >António Modesto</Tervezõ>
 </Logó>

 <Logó LOGÓKód="22">
  <Színek >Fekete</Színek>
  <Színek >Piros</Színek>
  <Színek >Arany</Színek>
  <Tervezõ >Anton Stankowski</Tervezõ>
 </Logó>

 <Logó LOGÓKód="23">
  <Színek >Kék</Színek>
  <Színek >Fehér</Színek>
  <Színek >Piros</Színek>
  <Tervezõ >Raymond Savignac</Tervezõ>
 </Logó>

 <Logó LOGÓKód="24">
  <Színek >Fehér</Színek>
  <Színek >Kék</Színek>
  <Színek >Piros</Színek>
  <Tervezõ >William C. Gibbons</Tervezõ>
 </Logó>

 <Logó LOGÓKód="25">
  <Színek >Égkék</Színek>
  <Színek >Fehér</Színek>
  <Színek >Sárga</Színek>
  <Tervezõ >Salvador Dellutri</Tervezõ>
 </Logó>


 <Csoport CSOPkód="11">
  <Jelölés >A</Jelölés>
 </Csoport>

 <Csoport CSOPkód="12">
  <Jelölés >B</Jelölés>
 </Csoport>

 <Csoport CSOPkód="13">
  <Jelölés >C</Jelölés>
 </Csoport>

 <Csoport CSOPkód="14">
  <Jelölés >D</Jelölés>
 </Csoport>

 <Csoport CSOPkód="15">
  <Jelölés >E</Jelölés>
 </Csoport>


 <Labdarúgó CSkód="1" Lkód="CR7">
  <Poszt >Középcsatár</Poszt>
  <Név >
   <Keresztnév >Cristiano</Keresztnév>
   <Vezetéknév >Ronaldo</Vezetéknév>
  </Név>
  <Gól >10</Gól>
  <Mezszám >7</Mezszám>
  <Szülidõ >1985.02.05</Szülidõ>
 </Labdarúgó>

 <Labdarúgó CSkód="1" Lkód="RN18">
  <Poszt >Középpályás</Poszt>
  <Poszt >Védekezõ középpályás</Poszt>
  <Név >
   <Keresztnév >Ruben</Keresztnév>
   <Vezetéknév >Neves</Vezetéknév>
  </Név>
  <Gól >2</Gól>
  <Mezszám >18</Mezszám>
  <Szülidõ >1997.03.13</Szülidõ>
 </Labdarúgó>

 <Labdarúgó CSkód="2" Lkód="TS1">
  <Poszt >Kapus</Poszt>
  <Név >
   <Keresztnév >Marc-André</Keresztnév>
   <Vezetéknév >ter Stegen</Vezetéknév>
  </Név>
  <Gól >0</Gól>
  <Mezszám >22</Mezszám>
  <Szülidõ >1992.04.05</Szülidõ>
 </Labdarúgó>

 <Labdarúgó CSkód="2" Lkód="JK6">
  <Poszt >Középpályás</Poszt>
  <Poszt >Jobb szélsõ védõ</Poszt>
  <Név >
   <Keresztnév >Joshua</Keresztnév>
   <Vezetéknév >Kimmich</Vezetéknév>
  </Név>
  <Gól >3</Gól>
  <Mezszám >6</Mezszám>
  <Szülidõ >1995.02.08</Szülidõ>
 </Labdarúgó>

 <Labdarúgó CSkód="3" Lkód="KM10">
  <Poszt >Középcsatár</Poszt>
  <Név >
   <Keresztnév >Kylian</Keresztnév>
   <Vezetéknév >Mbappé</Vezetéknév>
  </Név>
  <Gól >9</Gól>
  <Mezszám >10</Mezszám>
  <Szülidõ >1998.12.20</Szülidõ>
 </Labdarúgó>

 <Labdarúgó CSkód="3" Lkód="EC25">
  <Poszt >Középpályás</Poszt>
  <Poszt >Védekezõ középpályás</Poszt>
  <Poszt >Bal szélsõ védõ</Poszt>
  <Név >
   <Keresztnév >Eduardo</Keresztnév>
   <Vezetéknév >Camavinga</Vezetéknév>
  </Név>
  <Gól >3</Gól>
  <Mezszám >25</Mezszám>
  <Szülidõ >2002.11.10</Szülidõ>
 </Labdarúgó>

 <Labdarúgó CSkód="4" Lkód="HK9">
  <Poszt >Középcsatár</Poszt>
  <Név >
   <Keresztnév >Harry</Keresztnév>
   <Vezetéknév >Kane</Vezetéknév>
  </Név>
  <Gól >7</Gól>
  <Mezszám >9</Mezszám>
  <Szülidõ >1993.07.28</Szülidõ>
 </Labdarúgó>

 <Labdarúgó CSkód="4" Lkód="JB10">
  <Poszt >Középpályás</Poszt>
  <Név >
   <Keresztnév >Jude</Keresztnév>
   <Vezetéknév >Belligham</Vezetéknév>
  </Név>
  <Gól >6</Gól>
  <Mezszám >10</Mezszám>
  <Szülidõ >2003.06.29</Szülidõ>
 </Labdarúgó>

 <Labdarúgó CSkód="5" Lkód="LM10">
  <Poszt >Középcsatár</Poszt>
  <Poszt >Jobb szélsõ csatár</Poszt>
  <Név >
   <Keresztnév >Lionel</Keresztnév>
   <Vezetéknév >Messi</Vezetéknév>
  </Név>
  <Gól >9</Gól>
  <Mezszám >10</Mezszám>
  <Szülidõ >1987.07.24</Szülidõ>
 </Labdarúgó>

 <Labdarúgó CSkód="5" Lkód="EM23">
  <Poszt >Kapus</Poszt>
  <Név >
   <Keresztnév >Emiliano</Keresztnév>
   <Vezetéknév >Martinez</Vezetéknév>
  </Név>
  <Gól >0</Gól>
  <Mezszám >23</Mezszám>
  <Szülidõ >1992.09.02</Szülidõ>
 </Labdarúgó>


 <Mérkõzés Hkód="201" Mkód="1" Tkód="101">
  <Csapat1Gólok >5</Csapat1Gólok>
  <Csapat2Gólok >2</Csapat2Gólok>
 </Mérkõzés>

 <Mérkõzés Hkód="202" Mkód="2" Tkód="102">
  <Csapat1Gólok >0</Csapat1Gólok>
  <Csapat2Gólok >1</Csapat2Gólok>
 </Mérkõzés>

 <Mérkõzés Hkód="203" Mkód="3" Tkód="103">
  <Csapat1Gólok >3</Csapat1Gólok>
  <Csapat2Gólok >7</Csapat2Gólok>
 </Mérkõzés>

 <Mérkõzés Hkód="204" Mkód="4" Tkód="104">
  <Csapat1Gólok >2</Csapat1Gólok>
  <Csapat2Gólok >1</Csapat2Gólok>
 </Mérkõzés>

 <Mérkõzés Hkód="205" Mkód="5" Tkód="104">
  <Csapat1Gólok >2</Csapat1Gólok>
  <Csapat2Gólok >3</Csapat2Gólok>
 </Mérkõzés>


 <Helyszín Hkód="201">
  <Stadion >
   <Név >Education City Stadion</Név>
   <Férõhely >45000</Férõhely>
   <Tulajdonos >katari kormány</Tulajdonos>
  </Stadion>
  <Város >al-Rajján</Város>
 </Helyszín>

 <Helyszín Hkód="202">
  <Stadion >
   <Név >Al Bayt Stadion</Név>
   <Férõhely >60000</Férõhely>
   <Tulajdonos >katari kormány</Tulajdonos>
  </Stadion>
  <Város >al-Hor</Város>
 </Helyszín>

 <Helyszín Hkód="203">
  <Stadion >
   <Név >Loszaíli Nemzeti Stadion</Név>
   <Férõhely >80000</Férõhely>
   <Tulajdonos >katari kormány</Tulajdonos>
  </Stadion>
  <Város >Loszaíl</Város>
 </Helyszín>

 <Helyszín Hkód="204">
  <Stadion >
   <Név >al-Thumama Stadion</Név>
   <Férõhely >40000</Férõhely>
   <Tulajdonos >katari kormány</Tulajdonos>
  </Stadion>
  <Város >al-Thumama</Város>
 </Helyszín>

 <Helyszín Hkód="205">
  <Stadion >
   <Név >El-Dzsanúb Stadion</Név>
   <Férõhely >40000</Férõhely>
   <Tulajdonos >katari kormány</Tulajdonos>
  </Stadion>
  <Város >Al-Vakra</Város>
 </Helyszín>


 <Típus Tkód="101">
  <Név >Csoportmérkõzés</Név>
 </Típus>

 <Típus Tkód="102">
  <Név >Nyolcaddöntõ</Név>
 </Típus>

 <Típus Tkód="103">
  <Név >Negyeddöntõ</Név>
 </Típus>

 <Típus Tkód="104">
  <Név >Elõdöntõ</Név>
 </Típus>

 <Típus Tkód="105">
  <Név >Döntõ</Név>
 </Típus>


 <Mérkõzik Csapat1="1" Csapat2="2" Gyõztes="1" Mkód="1">
  <Dátum >2022.11.22</Dátum>
  <Játékvezetõ >Frank de Bleeckere</Játékvezetõ>
 </Mérkõzik>

 <Mérkõzik Csapat1="3" Csapat2="5" Gyõztes="5" Mkód="2">
  <Dátum >2022.11.26</Dátum>
  <Játékvezetõ >Pedro Proenca</Játékvezetõ>
 </Mérkõzik>

 <Mérkõzik Csapat1="2" Csapat2="1" Gyõztes="2" Mkód="3">
  <Dátum >2022.11.30</Dátum>
  <Játékvezetõ >Kim Milton Nielsen</Játékvezetõ>
 </Mérkõzik>

 <Mérkõzik Csapat1="4" Csapat2="5" Gyõztes="4" Mkód="4">
  <Dátum >2022.12.01</Dátum>
  <Játékvezetõ >Michel Vautrot</Játékvezetõ>
 </Mérkõzik>

 <Mérkõzik Csapat1="1" Csapat2="5" Gyõztes="1" Mkód="5">
  <Dátum >2022.12.18</Dátum>
  <Játékvezetõ >Oscar Ruiz</Játékvezetõ>
 </Mérkõzik>


</Világbajnokság_DLWGQZ>